{
  "gcp_version": "0.1",
  "receipt_id": "urn:gcp:lifecycle-receipt:complete-001",
  "capsule_digest": "sha256:dddddddddddddddddddddddddddddddddddddddddddddddddddddddddddddddd",
  "task_id": "urn:gcp:task:compliance-check-001",
  "runtime": "spiffe://example.com/runtime/compliance-1",
  "from_state": "EXECUTING",
  "to_state": "COMPLETED",
  "timestamp": "2026-08-12T02:00:00Z",
  "reason_codes": [],
  "result": {"uri": "https://artifacts.example.com/compliance/result-001", "digest": "sha256:5555555555555555555555555555555555555555555555555555555555555555", "media_type": "application/json"},
  "evidence": [],
  "proof": {"type": "DataIntegrityProof", "cryptosuite": "eddsa-jcs-2022", "verification_method": "spiffe://example.com/runtime/compliance-1#key", "created": "2026-08-12T02:00:00Z", "proof_purpose": "assertionMethod", "proof_value": "ZmFrZS1jb21wbGV0aW9u"}
}
